keywords,count
"COVID-19, behavioral health, mental health, outpatient mental health, telehealth, telemedicine",1
"Burns, Cigarettes, Fires, Home oxygen",1
"acute hospitals, alcohol dependence, alcohol withdrawal, readmission",1
"bariatric surgery, chronic rhinosinusitis, obesity",1
"database study, oral leukoplakia, oral lichen planus, oral squamous cell carcinoma, submucous fibrosis",1
"Adolescent, Critical care, Electronic health records, Substance use disorders, Young adult",1
"Adjuvant chemotherapy, Bladder cancer, Muscle-invasive urothelial carcinoma, Prospective cohort, Radical cystectomy, Survival",1
"adverse pregnancy outcome, alcohol misuse, cannabis use, maternal depression, maternal mental health, panic disorder (pd), suicidal ideation",1
"clinical pathway, lung nodules, pulmonary nodule service, pulmonary nodules",1
"Health Information Exchange, child health, data linkage, maternal health",1
"biomedical literature, drug labeling, knowledge gaps, maternal, opiates, opioids, pediatric",1
"AngioVac, PWID, percutaneous mechanical aspiration, tricuspid endocarditis, tricuspid valve replacement",1
"cohort study, health system epidemiology, substance use, transitional-aged youth, youth",1
"Substance use disorder, hepatitis A infection, hepatitis B infection, tetanus",1
"inpatient treatment, mental health systems/hospitals, violence/aggression",1
"Child welfare, Covid-19, Epidemiology, Parental, Polysubstance, Substance use",1
"Antidepressive agents, Cohort studies, Depressive disorder, Medication adherence, Real-world data",1
"comorbidities, costs, health care utilization, mental health",1
"discharge against medical advice, disparity, emergency department, inpatient admission, public health",1
"aging, biological age, hydration, hydration management, serum sodium",1
"NHANES, elderly, geriatric nutritional risk index, osteoarthritis, risk factors",1
"Cadmium, DNA methylation, Epigenetics, Lead, Mortality, National health and nutrition examination survey (NHANES)",1
"Addiction health services research, Inpatient addiction treatment, Medically supervised withdrawal, Medications for opioid use disorder, Opioid overdose, opioid agonist treatment",1
"data linkage, machine learning, opioid‐related disorders, self‐harm, suicide & feature analysis",1
"Burn Injuries, Opioid Dependence, Postoperative Complications, Substance Use Disorder",1
"Alcohol use disorder (AUD), cessation, insomnia, outcome measures, return to alcohol use, sleep disorder",1
"epidemiology, global health, human, machine learning, menopausal hormone therapy, neuroimaging, neuroscience, women's health",1
"HCV, infectious disease, maternal morbidity, neonatal morbidity, preterm birth, sexually transmitted infection",1
"Rotator cuff repair, arthroscopy, complications, non-tobacco nicotine dependence., opioid usage, postoperative pain",1
"adherence, antidepressants, children and adolescents, major depressive disorder, quality of care",1
